id,name,genre,brand,sticker,price,previous_price,discount,description,rating,n_reviews,color,_id
9bcd0cef-2c82-4ebd-82b4-bf6bf3cae5c5_c27,Balón baloncesto Wilson NBA Team Alliance – Portland Blazers,Unisex,WILSON,,44.0,,False,Balón fútbol adidas Hologram Coupe du Monde 2022,,0,marrón / marrón / marrón,66426993f8fe2680f3a09cd7
1325a9ef-c5e2-4210-a92f-6428b6ba143f_c4.c14.c5,Balón rugby Gilbert Gloucester,Unisex,GILBERT,,40.0,,False,"El balón réplica del Grloucester es una réplica exacta del balón utilizado en los partidos oficiales, lo que lo convierte en el producto ideal para mostrar tu apoyo a tu equipo favorito.",,0,blanco / rojo / azul,6642699bf8fe2680f3a09cd8
4c0449e7-4deb-49b4-9b9e-a58eac2dad39_c20,Balón baloncesto Spalding React TF 250 T5,Unisex,SPALDING,,54.0,,False,Esta pelota ha sido diseñada para ser jugada en todas las superficies y ofrece buenas sensaciones y un agarre interesante.,,0,naranja / naranja / naranja,664269a5f8fe2680f3a09cd9
22ee0cf8-d5ce-4ff4-b0b5-5372f2e4c791_c22.c5.c14,balón de rugby de espuma,Unisex,NETSPORTIQUE,,27.99,35.0,True,"El balón de rugby perfecto para los niños, hecho de espuma podrán jugar con él todo el día sin hacerse daño. Utiliza este balón en un jardín, un parque o incluso en la playa 🏉.",,0,amarillo / azul / rojo,664269adf8fe2680f3a09cda
3c20e38f-9752-4464-b5ae-4a89f519e2fa_c27,Balón baloncesto Wilson NBA Team Alliance – Atlanta Hawks,Unisex,WILSON,,44.0,,False,Esta pelota de baloncesto para todas las franquicias de la NBA ofrece una sensación de nivel profesional y mayor durabilidad.,,0,marrón,664269b6f8fe2680f3a09cdb
fde41425-a66c-45e3-9085-330b9cd3630c_c20.c1,Balón de baloncesto oficial Pro 3.0,Unisex,ADIDAS,,65.0,,False,Eleva tu juego,,0,naranja / negro,664269c0f8fe2680f3a09cdc
fb465995-a869-4a7a-99a8-56991784efc8_c27,Balón fútbol de la NFL Wilson des Tennessee Titans,Unisex,WILSON,,35.0,,False,"Balón de fútbol americano de tamaño oficial con el logotipo de los Tennessee Titans para uso recreativo/de ocio, también adecuado para coleccionistas y aficionados.",,0,marrón / marrón / marrón,664269c8f8fe2680f3a09cdd
08b4b46b-6bec-41c5-ba33-4b6ebf9078e6_c4,Balón rugby Gilbert Oficial Sirius Wales,Unisex,GILBERT,,184.0,,False,El balón SIRIUS Wales es el nuevo balón oficial de la selección de Gales para todas sus competiciones e incorpora los colores de Gales con el logotipo de la WRU.,,0,blanco,664269d1f8fe2680f3a09cde
d6e0468b-5a82-4daa-83e6-d436ef6fd3f8_c14,Balon Fútbol Equilibrium 3.0 Talla 5,Unisex,VIMAS SPORT,,14.99,,False,Excelente Balón de entrenamiento talla 5,,0,rojo,664269daf8fe2680f3a09cdf
2f90cc18-b584-45f2-ab3e-898414e7d130_c4.c14,Balón primera equipación FC Bayern Club,Unisex,ADIDAS,,30.0,,False,Emula a las estrellas del FC Bayern,,0,blanco / rojo,664269e2f8fe2680f3a09ce0
b9fd71e7-5e29-484d-96d0-cb3adfbdaef0_c51.c14,Balón Voleibol Wilson Super Soft Play Smu,Unisex,WILSON,,16.0,69.0,True,Balón de voleibol Wilson de alta calidad con diseño suave y duradero para un juego óptimo en interiores y exteriores.,,0,azul azur / azul azur / rojo,664269ebf8fe2680f3a09ce1
d40a6354-8f27-4a7f-8047-2876d78dd2f2_c4.c15,Balón rugby Gilbert Réplica Olímpica de Tokio,Unisex,GILBERT,,44.0,,False,Réplica oficial del balón Gilbert para los Juegos Olímpicos de Tokio 2020. Era la primera vez que se podían comprar balones olímpicos de rugby 7.,,0,blanco / burdeos,664269f3f8fe2680f3a09ce2
27ccbeb5-39b9-42ab-92fc-0f073bea77da_c4,Balón de rugby Stade Toulousain Groupama Gilbert,Unisex,GILBERT,,40.0,,False,Descubra la réplica del balón de rugby del Stade Toulousain que utilizan los jugadores durante sus partidos en casa.,,0,blanco,664269fbf8fe2680f3a09ce3
ca857f30-5766-405b-a124-8659edabba7d_c4.c5,Balón rugby de las Islas Gilbert Samoa,Unisex,GILBERT,,34.0,,False,"El balón réplica de Samoa es una réplica exacta del balón utilizado en los partidos oficiales, lo que lo convierte en el producto perfecto para mostrar tu apoyo a tu equipo favorito.",,0,blanco / azul / azul,66426a06f8fe2680f3a09ce4
7d3c8257-353b-458f-bd30-6fff2315f061_c4,Balón rugby Gilbert Sporting Club Albi,Unisex,GILBERT,,40.0,,False,"El Sporting Club Albigeois, SCA, viene de la ciudad de Albi, situada en Occitania",,0,blanco / blanco,66426a0ff8fe2680f3a09ce5
e2474635-0c9e-41d1-a970-76c4baf31a51_c251,Balonmano Spectrum Synergy Pro KEMPA,Unisex,KEMPA,,94.0,,False,KEMPA Spectrum Synergy Pro,,0,gris,66426a18f8fe2680f3a09ce6
22f974ce-ec93-450e-9866-c37c7f74fcad_c5,Baloncesto Molten,Unisex,MOLTEN,,30.0,,False,"Baloncesto de caucho fundido con 8 paneles, este balón de baloncesto es perfecto para su uso al aire libre. En talla 7",,0,azul / azul / azul,66426a20f8fe2680f3a09ce7
939ecc01-2f4d-476c-926e-ae55ddf6d160_c4.c197,Balón Oficial Molten UEFA Europa League 2023/2024,Unisex,MOLTEN,,145.0,,False,Balón de fútbol Molten Europa League. Balón oficial tamaño 5. Temporada 2023/2024. Mayor velocidad y vuelo más recto del balón.,,0,blanco / blanco / naranja,66426a29f8fe2680f3a09ce8
8984fc96-2e63-4d4b-865e-b548dd4761dd_c4.c14.c251,Balón de rugby Kappa Marco,Unisex,KAPPA,,17.5,25.0,True,"Este balón de rugby es ideal para el entrenamiento diario y los partidos improvisados. Suave y adherente, ofrece un excelente agarre en todas las circunstancias.",,0,blanco / rojo / gris,66426a31f8fe2680f3a09ce9
de04f101-5c4b-4ea2-9118-cce4a5ec7b8c_c4.c255,Balón Puma Orbita 6 MS,Unisex,PUMA,,26.99,,False,Balón Puma Orbita 6 MS,,0,blanco / blanco / multicolor,66426a3af8fe2680f3a09cea
535fed50-383b-444f-8ffa-b2364a2b32eb_c8.c5.c4,Balón Hanball Molten HX5000,Unisex,MOLTEN,,90.0,,False,"Balonmano Molten HX5000 para un lanzamiento perfecto. El balón de balonmano Molten ""HX5000-BW"" está hecho de cuero sintético y ofrece un muy buen comportamiento de salto y vuelo.",,0,azul oscuro / azul / blanco,66426a43f8fe2680f3a09ceb
cf0e7879-c797-45b8-baf3-5d164e356835_c22.c16,Balón baloncesto Molten 3X3 T5000,Unisex,MOLTEN,,70.0,,False,Balón Molten Oficial aprobado para la competición mundial FIBA 3x3,,0,amarillo / amarillo / violeta,66426a4bf8fe2680f3a09cec
deb3310e-e26b-4465-b1bf-012a52f8d71b_c1.c22,Balón de Street Baloncesto 3v3,Unisex,POWER SHOT,,32.99,38.0,True,Este balón de Street baloncesto es ideal para jugar tus partidos 3v3 en superficies como el asfalto sin preocuparte de que el balón se desgaste. 🏀,,0,negro / amarillo,66426a54f8fe2680f3a09ced
c69a43e5-a8a4-4b6d-99c4-e94c2fe457fe_c255,Balón Baloncesto Wilson Nba Team Tribute Magic,Unisex,WILSON,,34.57,174.0,True,"Balón de baloncesto oficial de la NBA con diseño Tribute Magic, ideal para cualquier fanático del baloncesto.",,0,multicolor,66426a5cf8fe2680f3a09cee
b9ec60d7-69ab-48f5-95a1-95e3fdb85bfc_c20.c5,Baloncesto Spalding TF 500 Compuesto LNB 2022 T7,Unisex,SPALDING,,59.0,,False,"De muy alta calidad, esta pelota de baloncesto Spalding TF-500 es duradera y adecuada para uso en interiores y exteriores.",,0,naranja / azul,66426a65f8fe2680f3a09cef
64a201bc-43de-4882-9e73-fa06fba7aac5_c5.c195.c238,Balón baloncesto Wilson NBA Team Tribute – Charlotte Hornets,Unisex,WILSON,,35.0,,False,"Apoya a tu equipo favorito con el balón Wilson NBA Team Tribute, que presenta un patrón alternado de los colores icónicos del equipo con el logotipo de la franquicia en un lugar destacado.",,0,azul / azul marino / turquesa,66426a6df8fe2680f3a09cf0
c212ee44-e30e-4c3e-832d-d3c2bc075742_c255,Balón Baloncesto Wilson Nba Team Tribute Cavaliers,Unisex,WILSON,,34.57,174.0,True,"Balón de baloncesto oficial del equipo de los Cavaliers de la NBA, diseñado por Wilson con colores y logos auténticos para los seguidores del equipo.",,0,multicolor,66426a76f8fe2680f3a09cf1
e49e804d-9e92-49d1-aa7b-13800e0d81ff_c4.c1,Balón rugby Gilbert Ulster,Unisex,GILBERT,,40.0,,False,"El balón réplica del Ulster es una réplica exacta del balón utilizado en los partidos oficiales, lo que lo convierte en el producto perfecto para mostrar tu apoyo a tu equipo favorito.",,0,blanco / blanco / negro,66426a7ff8fe2680f3a09cf2
4850ee06-ca47-4bff-95c0-b9b10992144f_c27.c1,Balón fútbol de la NFL Wilson GST Composite 1780,Unisex,WILSON,,45.0,,False,Con sus cordones LCD patentados y la cubierta de cuero compuesto duradero se combinan para ofrecer una alternativa más asequible a la serie GST de balones de cuero.,,0,marrón / marrón / negro,66426a88f8fe2680f3a09cf3
c77a2ac8-03fa-4db9-997c-215781f89c5c_c255,Balón Baloncesto Wilson Nba Team Tribute Pacers,Unisex,WILSON,,34.57,174.0,True,"Balón de baloncesto oficial de la NBA con diseño exclusivo del equipo Indiana Pacers, ideal para fans y jugadores. ¡Calidad Wilson garantizada!",,0,multicolor,66426a90f8fe2680f3a09cf4
83e0c1c0-8c76-48d7-a13e-aa02dca87de9_c255,BALÓN SOPORTE PERPIGNAN T5,Unisex,GILBERT,,28.0,,False,"Muestra tu orgullo por Perpignan con este balón Gilbert T5, que combina los colores y el logotipo del club para una experiencia de rugby auténtica.",,0,multicolor,66426a98f8fe2680f3a09cf5
28185b06-f1b4-4872-83ea-e2833bef9326_c4.c5,Balón Hanball Molten D60 T3,Unisex,MOLTEN,,64.0,,False,Balón para partidos y competiciones,,0,blanco / blanco / azul,66426aa2f8fe2680f3a09cf6
e7a93250-f677-4824-b911-a3f1cd6b9400_c5,Balón de Rugby Gilbert Copa del Mundo Escocia 2023,Unisex,GILBERT,,37.0,,False,Gilbert creó el balón integrando la bandera y los colores de Escocia con el diseño del Mundial 2023.,,0,azul,66426aaaf8fe2680f3a09cf7
218c7ed1-0e12-40ec-8a18-94d13a98be0b_c4,Balón adidas Pro Sala Euro Futsal,Unisex,ADIDAS,,60.0,,False,Este balón adidas Pro cosido a mano está diseñado para el rendimiento en pista cubierta.,,0,blanco,66426ab3f8fe2680f3a09cf8
999707c5-3d9e-42ec-bdbe-743e40acb8c2_c4.c5.c9,Balón de rugby de entrenamiento Gilbert Rebounder,Unisex,GILBERT,,37.0,,False,"Esta mitad del balón permite practicar pases sin necesidad de un compañero, gracias a una base plana que permite practicar contra una pared.",,0,blanco / azul / verde,66426abcf8fe2680f3a09cf9
9a18f6a2-8f31-4d4e-8ce4-21c1cac32f18_c4.c1,Balón Wilson NBA Team Tribute - Utah Jazz,Unisex,WILSON,,35.0,,False,Baloncesto de exterior Wilson NBA Team Tribute All Surface de sus Utah Jazz. Con el logotipo del equipo destacado en la cubierta frontal.,,0,blanco / negro / blanco,66426ac5f8fe2680f3a09cfa
32736440-3e54-40e3-810c-f7c53cde6f93_c4.c14,Balón Hanball Molten D60,Unisex,MOLTEN,,64.0,,False,Balón para partidos y competiciones,,0,blanco / blanco / rojo,66426acdf8fe2680f3a09cfb
b0d5e932-59f0-4e53-ae14-0f71eb0f1c69_c14,Balón de Rugby Gilbert Copa del Mundo Georgia 2023,Unisex,GILBERT,,37.0,,False,Gilbert creó el balón integrando la bandera y los colores de Georgia con el diseño del Mundial 2023.,,0,rojo,66426ad6f8fe2680f3a09cfc
305be870-da01-4caa-b106-69c04076c21c_c4,Balón rugby Gilbert Réplica Champions Cup Copa de Europa Investec,Unisex,GILBERT,,40.0,,False,La Copa de Campeones de la Copa de Europa profesional de rugby y Gilbert diseñaron el balón réplica.,,0,blanco,66426adff8fe2680f3a09cfd
8268cf61-28ba-417a-a3d2-2ba2dcf118c7_c20,Baloncesto Wilson Avenger Talla 7,Unisex,WILSON,,29.9,,False,Baloncesto Talla 7. Para todo tipo de cancha. Perfecto para juegos improvisados y de ocio. Balón de tamaño oficial.,,0,naranja,66426ae7f8fe2680f3a09cfe
6784210d-d44c-4f30-adcb-d02f379964f5_c255.c5.c6,Balón de Rugby Gilbert Copa del Mundo Italia 2023,Unisex,RUGBY WORLD CUP 2023,,37.0,,False,Gilbert creó el balón integrando la bandera y los colores de Italia con el diseño del Mundial 2023.,,0,multicolor / azul / azul claro,66426af0f8fe2680f3a09cff
840f20e1-b7ae-4604-915c-bb61867283fd_c5,Balón de Rugby Gilbert Copa del Mundo Namibia 2023,Unisex,GILBERT,,37.0,,False,Gilbert creó el balón integrando la bandera y los colores de Namibia con el diseño del Mundial 2023.,,0,azul,66426af8f8fe2680f3a09d00
01dff3a7-dddc-4fc7-8acb-3b791fdd9d23_c4,Balón rugby Gilbert Oficial Sirius Englaterra,Unisex,GILBERT,,184.0,,False,El balón SIRIUS Inglaterra es el nuevo balón oficial de la selección inglesa para todas sus competiciones e incorpora los colores de Inglaterra con el logotipo de Inglaterra Rugby.,,0,blanco,66426b01f8fe2680f3a09d01
9891e7a4-c523-4027-a5d7-654cc3865d7a_c20.c5,Balón de baloncesto Spalding TF 250 Composite LNB 2022 T6,Unisex,SPALDING,,54.0,,False,La pelota de baloncesto Spalding TF-250 es duradera gracias a su cuero sintético de alta calidad. Adecuado para uso en interiores y al aire libre. Buen agarre e ideal para regatear.,,0,naranja / naranja / azul,66426b09f8fe2680f3a09d02
b248a1aa-d536-4a13-8caf-3f4047532ef2_c8.c98.c20,Balonmano Kempa Buteo,Unisex,KEMPA,,67.99,,False,"Excelente rebote combinado con un tacto suave gracias a la laminación de espuma multicapa concentrada, la vejiga de látex ofrece un rebote excepcional y retención de aire al mismo tiempo.",,0,azul oscuro / azul petróleo / naranja,66426b12f8fe2680f3a09d03
0e8db664-145c-4707-bba8-319f13426d57_c20.c197,Balón Baloncesto Spalding TF 1000 Precision FIBA T7,Unisex,SPALDING,,84.0,,False,¡Nueva tecnología para un toque de gama alta!,,0,naranja / naranja / naranja,66426b1af8fe2680f3a09d04
1a27f8af-a0ee-4c88-b762-491b26b8b596_c22,Balón baloncesto Spalding Officiel TF33 Gold,Unisex,SPALDING,,61.99,,False,"Aprobado por FIBA, este balón ha sido diseñado para jugar 3x3 con una talla 6 y el peso de una talla 7.",,0,amarillo / amarillo,66426b23f8fe2680f3a09d05
fc9e8eb6-b4ce-40fb-9c1c-f35d5c20b13f_c5.c195,Balón baloncesto Wilson NBA Team Tribute - Minnesota Timberwolves,Unisex,WILSON,,35.0,,False,"Apoya a tu equipo favorito con el balón Wilson NBA Team Tribute, que presenta un patrón alternado de los colores icónicos del equipo con un destacado logotipo de la franquicia.",,0,azul / azul marino / azul,66426b2bf8fe2680f3a09d06
00606de7-83eb-4b60-9627-80d8613c2747_c27,Balón baloncesto Wilson NBA Team Alliance – Utah Jazz,Unisex,WILSON,,44.0,,False,Esta pelota de baloncesto para todas las franquicias de la NBA ofrece una sensación de nivel profesional y mayor durabilidad.,,0,marrón / marrón / marrón,66426b34f8fe2680f3a09d07
13f77473-e254-478a-b513-21800fd9a66a_c9.c14,Balonmano Hummel Elite HB T3,Unisex,HUMMEL,,50.99,,False,Balonmano de partido y entrenamiento con excelente agarre y jugabilidad,,0,verde / verde / rojo,66426b3df8fe2680f3a09d08
ad6156d9-5e9e-4019-ab03-041d2614ecdb_c27.c197,Balón baloncesto Spalding TF Model M Officiel Cuir T7,Unisex,SPALDING,,249.95,,False,La pelota premium de Spalding está diseñada con 125 años de experiencia Spalding y ofrece un rendimiento inigualable y un control y una sensación excepcionales.,,0,marrón / naranja / naranja,66426b46f8fe2680f3a09d09
cc3e8953-b68d-4bfa-9eac-abd1a6ee2894_c4.c1,Balón rugby Gilbert TOP 14 G-TR4000,Unisex,GILBERT,,35.0,,False,El balón réplica G-TR4000 Top 14 es una réplica exacta del balón utilizado en los partidos oficiales.,,0,blanco / blanco / negro,66426b4ef8fe2680f3a09d0a
6a33797d-4124-46e2-a185-77968ba74ede_c20.c8.c135,Balonmano LEO KEMPA,Unisex,KEMPA,,30.0,,False,KEMPA LEO,,0,naranja / azul oscuro / naranja fluorescente,66426b57f8fe2680f3a09d0b
570ccb39-4e16-4e7f-b8af-258d81f0caba_c27,Balón fútbol americano de Philadelphia Eagles Wilson,Unisex,WILSON,,35.0,,False,"Balón de fútbol americano de tamaño oficial con el logotipo de los Philadelphia Eagles para uso recreativo/de ocio, también adecuado para coleccionistas y aficionados.",,0,marrón / marrón / marrón,66426b60f8fe2680f3a09d0c
7180434e-f1fd-49f5-946d-24396026a3d6_c5.c195.c224,Balón homenaje al equipo de la NBA Wilson - Memphis Grizzlies,Unisex,WILSON,,35.0,,False,"Apoya a tu equipo favorito con el balón Wilson NBA Team Tribute, que presenta un patrón alternado de los colores icónicos del equipo con un destacado logotipo de la franquicia.",,0,azul / azul marino / azul celeste,66426b69f8fe2680f3a09d0d
606e7440-b2e8-41e9-90ff-f9b85a177131_c4.c5,Balón de fútbol sala Select Super Tb V22,Unisex,SELECT,,94.0,,False,"Balón de fútbol sala de alta gama, ideal para competiciones y torneos. Su forma redonda garantiza una gran calidad, tiro tras tiro.",,0,blanco / azul / blanco,66426b72f8fe2680f3a09d0e
3152e627-ce7e-4c07-bb8a-78e520f23e54_c4.c14,Balón de rugby Gilbert Morgan Pass Developper Talla 4,Unisex,GILBERT,,71.9,,False,"Para garantizar un juego de calidad, los pases de los jugadores deben ser precisos, incluso a larga distancia. Un balón lastrado de alrededor de 1 kg.",,0,blanco / blanco / rojo,66426b7af8fe2680f3a09d0f
22fd6804-a6fb-4aca-8675-e50bbacbd228_c255,Balón Baloncesto Wilson Nba Team Tribute Wizards,Unisex,WILSON,,26.63,174.0,True,Balón de baloncesto oficial de la NBA con diseño de Wizards para los fanáticos del baloncesto. Alta calidad y durabilidad garantizada. ¡Diversión asegurada en cada juego!,,0,multicolor,66426b83f8fe2680f3a09d10
15b415bd-b23f-4f47-81eb-588ff68e7e48_c255,Balón de rugby Gilbert RCT Supporter,Unisex,GILBERT,,40.8,50.09,True,Toulon es un club de rugby de renombre mundial situado en el sur de Francia. La ciudad es la primera base naval de Francia.,,0,multicolor,66426b8cf8fe2680f3a09d11
9680d199-7d1d-45ff-8441-822f454dbec8_c4.c255,Balón UWCL League Eindhoven,Unisex,ADIDAS,,35.0,,False,Juega y entrena como las profesionales,,0,blanco / multicolor,66426b95f8fe2680f3a09d12
472a6224-693c-4bab-9c3a-7e00f57dcc10_c14,Balonmano de competición Molten FFHB HX5001,Unisex,MOLTEN,,104.0,,False,Balón de gama alta. Excelentes características técnicas y excelente confort de juego. Muy buena calidad de rebote y trayectoria óptima.,,0,rojo / rojo / rojo,66426b9df8fe2680f3a09d13
ba008b90-6f8e-42a6-9095-86f8a0793f58_c255,BALÓN SOPORTE T5 CLERMONT GILBERT,Unisex,GILBERT,,39.4,48.41,True,"Lleva el espíritu del ASM a todas partes con este balón de apoyo Gilbert T5. Perfecto para partidos recreativos, luce con orgullo los colores del club.",,0,multicolor,66426ba6f8fe2680f3a09d14
d5cbf782-1276-44e7-9b0b-7c5577daa4f5_c4.c20,Balón baloncesto Molten BG4000,Unisex,MOLTEN,,80.0,,False,Balón perfecto para usar en competición o en entrenamiento,,0,blanco / naranja / naranja,66426baef8fe2680f3a09d15
4bc5ab9c-ecdb-4dd7-8d41-4d7403be2e19_c27,Balón fútbol de la NFL Wilson des Los Angeles Chargers,Unisex,WILSON,,35.0,,False,"Balón de fútbol americano de tamaño oficial con el logotipo de los Chargers de Los Ángeles para uso recreativo/de ocio, también adecuado para coleccionistas y aficionados.",,0,marrón / marrón / marrón,66426bb7f8fe2680f3a09d16
fff802cf-40e6-46b4-b17e-ca7f346264ae_c4,Balón de Rugby Gilbert Munster Supporter,Unisex,GILBERT,,28.0,,False,Demuestra tu pasión por el Munster Rugby Club con el balón de rugby Gilbert Supporter. Añádelo a tu colección o presume de él en el campo.,,0,blanco,66426bbff8fe2680f3a09d17
d3ba89ec-3201-47f3-81a2-0c2abb061816_c5.c1,Balonmano Leo KEMPA,Unisex,KEMPA,,29.7,34.13,True,KEMPA Leo,,0,azul / azul / negro,66426bc8f8fe2680f3a09d18
a7a779a3-eb2f-474b-b5f8-c50496e1be61_c4,Balón rugby Gilbert Pau,Unisex,GILBERT,,40.0,,False,La réplica del balón de la Sección Paloise es una réplica exacta del balón utilizado en los partidos oficiales,,0,blanco,66426bd1f8fe2680f3a09d19
0a59e99c-055c-4e9c-99a7-4157aa18dd93_c20,Baloncesto Spalding All Star Game Paris Talla 7,Unisex,SPALDING,,124.0,,False,El LNB TF-1000 es lo último en cuero sintético. Balón especialmente diseñado para el juego de alto nivel. Muy alta durabilidad.,,0,naranja,66426bdaf8fe2680f3a09d1a
fdd3543f-4eeb-46a3-b8d6-b292b66359b2_c4,Balón rugby Gilbert FC Grenoble,Unisex,GILBERT,,41.0,,False,"La réplica de balón del Grenoble es una réplica exacta del balón utilizado en los partidos internacionales, lo que le convierto en el producto ideal para mostrar tu apoyo a tu equipo favorito.",,0,blanco,66426be3f8fe2680f3a09d1b
74243559-3198-488c-ac6a-1af38abfb1bb_c255,BALÓN DE APOYO RACING GILBERT T5,Unisex,GILBERT,,28.0,,False,"Representa al Racing 92 con este balón Gilbert en los colores del club, perfecto para los aficionados y los partidos recreativos.",,0,multicolor,66426becf8fe2680f3a09d1c
a7ccce7c-c359-4f96-be60-106fa03351be_c20,Balón Baloncesto Wilson EVO NXT GAME BALL AFRICA LEAGUE,Unisex,WILSON,,100.0,,False,"El balón oficial de la Liga Africana de Baloncesto combina durabilidad, agarre y control de la humedad para dar a los jugadores la libertad de movimiento y la sensación que necesitan para ganar",,0,naranja / naranja / naranja,66426bf5f8fe2680f3a09d1d
b384bfdf-6703-44fd-a09d-7b5b0036d8d1_c4.c255,Balón de fútbol  Champions League Match oficial Adidas,Mujer,ADIDAS,,150.0,,False,Globo de fútbol Adidas Mujer Champions League Match oficial.,,0,blanco / multicolor / multicolor,66426bfdf8fe2680f3a09d1e
1311819e-7d38-444d-ab81-abb33077a432_c22.c5.c251,Balón Fútbol SELECT X-Turf (FIFA BASIC),Unisex,SELECT,,46.99,,False,Balón Fútbol SELECT X-Turf (FIFA BASIC),,0,amarillo / azul / gris,66426c06f8fe2680f3a09d1f
a43f7475-1a24-41f1-ba8b-dfd8b19189aa_c1,Balón Baloncesto interior y exterior Spalding Control Avanzado del Agarre NEGRO,Unisex,SPALDING,,79.95,,False,La pelota Spalding Advanced Grip Control InOut 76871Z es una pelota de baloncesto revolucionaria diseñada para llevar tu juego al siguiente nivel.,,0,negro / negro / negro,66426c0ff8fe2680f3a09d20
dd4ab9f9-94a3-41f0-8adb-f99cbd7c60e5_c4,Balón de rugby Gilbert Agen,Unisex,GILBERT,,40.0,,False,"La réplica del balón del Agen es una réplica exacta del balón utilizado en los partidos oficiales, lo que le convierto en el producto ideal para mostrar tu apoyo a tu equipo favorito.",,0,blanco,66426c17f8fe2680f3a09d21
376ab9fe-9616-49e1-a086-0a4fb522e085_c4.c5,Balón fútbol Select IMS Team V23,Unisex,SELECT,,45.0,,False,El balón de fútbol más popular de la gama Select.,,0,blanco / azul / blanco,66426c20f8fe2680f3a09d22
8ce6776d-ad51-4c94-b04d-ebcdd78941a7_c255,Balón Voleibol Playa Wilson Avp Style,Unisex,WILSON,,19.5,,False,Balón de voleibol de playa diseñado con estilo AVP para jugar con precisión y comodidad en la arena. Fabricado por Wilson para rendimiento óptimo.,,0,multicolor,66426c28f8fe2680f3a09d23
862ced53-19ca-49ab-b3e2-b76226af403e_c255,Balón Baloncesto Wilson Nba Team Tribute Suns,Unisex,WILSON,,27.99,174.0,True,"Balón oficial de baloncesto con diseño del equipo NBA Phoenix Suns, ideal para practicar y mostrar tu apoyo a tu equipo favorito.",,0,multicolor,66426c31f8fe2680f3a09d24
e21a004f-b062-4164-9db1-a89f26b01ea5_c255,Balón Baloncesto Wilson Nba Team Tribute Timber,Unisex,WILSON,,26.63,174.0,True,"Balón de baloncesto de alta calidad con diseño de homenaje a los Timber, ideal para jugar como un profesional en la cancha.",,0,multicolor,66426c3af8fe2680f3a09d25
d7787cb4-41f1-4546-ac87-84494c8e3592_c1.c14.c5,Balonmano SOFT KEMPA,Unisex,KEMPA,,27.99,,False,KEMPA SOFT,,0,negro / rojo / azul,66426c43f8fe2680f3a09d26
e9605475-98a7-49aa-985e-0d98ada7a073_c9.c4.c1,Balón Celtic FC Club,Unisex,ADIDAS,,28.0,,False,Para incondicionales del Celtic FC,,0,verde / blanco / negro,66426c4cf8fe2680f3a09d27
4e3dce67-9cde-4541-b289-64438e10b3e8_c5.c27,Balón de baloncesto Wilson NBA Team Tribute - Denver Nuggets,Unisex,WILSON,,35.0,,False,"Apoya a tu equipo favorito con el balón Wilson NBA Team Tribute, que presenta un patrón alternado de los colores icónicos del equipo con el logotipo de la franquicia en un lugar destacado.",,0,azul / azul / marrón,66426c55f8fe2680f3a09d28
a70c24f9-f9fc-4107-b295-e85101ee2d06_c22,Balonmano Spectrum Synergy Primo KEMPA,Unisex,KEMPA,,54.0,,False,KEMPA Spectrum Synergy Primo,,0,amarillo,66426c5df8fe2680f3a09d29
519f7b3a-410c-498d-8671-6dc578d748cf_c14.c5,Balonmano Spectrum Synergy Primo KEMPA,Unisex,KEMPA,,54.0,,False,KEMPA Spectrum Synergy Primo,,0,rojo / azul / azul,66426c66f8fe2680f3a09d2a
29bd7863-5195-40bd-940c-cd65e5d22710_c5,Balón Hanball Molten HX1800 T1,Unisex,MOLTEN,,27.0,,False,Globo de entrenamiento Molten tamaño 1,,0,azul / azul / azul,66426c6ff8fe2680f3a09d2b
c73cbdfa-fb5e-4966-8fbd-369a658c869e_c255.c22,Balón de fútbol Orbita La Liga 1 PUMA Dandelion Multi Colour Yellow,Unisex,PUMA,,140.0,,False,"Entra en el campo como las estrellas de La Liga con nuestro Orbita La Liga 1, el balón oficial de la liga española. Diseñado con el ADN deportivo de PUMA.",,0,multicolor / amarillo,66426c77f8fe2680f3a09d2c
b64547a9-4aaf-4212-9709-fc738eedf087_c255,Balón Voleibol Wilson Pxl Vb Blanco/rojo/violeta,Unisex,WILSON,,18.0,24.0,True,"Balón de voleibol Wilson de alta calidad en colores blanco, rojo y violeta. Perfecto para entrenamientos y competencias en interiores y exteriores.",,0,multicolor,66426c80f8fe2680f3a09d2d
cb60b6a0-c035-4a53-ab86-9760682a1da9_c5,Balón Rugby Rebond The Feebles,Unisex,REBOND,,54.0,,False,"Balón de calidad partido. Pintado y cosido a mano en la India, en una fábrica dedicada al comercio justo y etiquetado Fairtrade.",,0,azul,66426c89f8fe2680f3a09d2e
f0b66cfc-317f-45b1-9c8a-4abb04c05bd1_c4.c1,Balón de fútbol Adidas Tango Glider,Unisex,ADIDAS,,24.95,,False,"Este balón está diseñado para volar sobre el terreno de juego. Cosido a máquina para una mejor sensación, tiene una vejiga de butilo altamente resistente.",,0,blanco / negro,66426c91f8fe2680f3a09d2f
9c5bfd2d-3447-4245-9116-6c9194e7060e_c20.c5,Balón balonmano Molten HX1800 T0,Unisex,MOLTEN,,27.0,,False,Balón de entrenamiento Molten 32 paneles cosidos a máquina,,0,naranja / naranja / azul,66426c9af8fe2680f3a09d30
9861d962-a36b-4029-a722-79678c96e374_c255,Balón de Rugby Gilbert Navidad,Unisex,GILBERT,,30.0,,False,"Gilbert ha diseñado una selección de globos de ocio con motivos humorísticos, el regalo ideal tanto para niños como para adultos.",,0,multicolor / multicolor / multicolor,66426ca2f8fe2680f3a09d31
8eac3acd-bfa3-40b7-bffc-dc7a6f88aac4_c4,Balón rugby Gilbert del US Montauban,Unisex,GILBERT,,40.0,,False,La Unión Deportiva de Montauban es un club de rugby francés XV con sede en Montauban.,,0,blanco,66426cabf8fe2680f3a09d32
