id,name,genre,brand,sticker,price,previous_price,discount,description,rating,n_reviews,color,_id
8821974,BALÓN DE FÚTBOL PUMA ORBITA LIGA ESPAÑOLA 23/24,Unisex,PUMA,,21.99,31.99,True,Concebido para maximizar tu rendimiento el día del partido.,4.5,16,,664256aff8fe2680f3a09ab3
8869111,Balón de Fútbol Adidas entrenamiento Euro 24 Fussballliebe,Unisex,ADIDAS,,23.99,29.99,True,"Un balón de entrenamiento duradero inspirado en el mayor torneo de fútbol europeo, la Eurocopa 2024 en Alemania.",4.6,15,,664256b8f8fe2680f3a09ab4
8869113,Balón de Fútbol Adidas Euro 24 Fussballliebe League,Unisex,ADIDAS,,31.99,39.99,True,"Un balón de partido inspirado en el mayor torneo de fútbol europeo, la Eurocopa 2024 en Alemania.",3.8,11,,664256c0f8fe2680f3a09ab5
8789910,Balón de fútbol cosido a máquina TRAINING BALL talla 5 blanco,Unisex,KIPSTA,,9.99,,False,"Hemos concebido y desarrollado este balón F100 para los y las futbolistas que se inician en el fútbol en club, o que juegan ocasionalmente.",4.3,70,,664256c8f8fe2680f3a09ab6
8547126,Balón Baloncesto Tarmak R100 Talla 5 amarillo,Unisex,TARMAK,,6.99,,False,"Balón de baloncesto de talla 5 oficial, adecuado para jugar en exterior o en interior, para niños y niñas de 7 a 10 años.",4.7,481,amarillo fluorescente,664256d1f8fe2680f3a09ab7
960301,Balón Fútbol Espuma Imviso Talla 3 Rojo,Unisex,KIPSTA,,5.99,,False,Hemos desarrollado este balón para quienes quieren familiarizarse con los primeros gestos técnicos del fútbol sala con total seguridad.,4.6,543,rojo,664256daf8fe2680f3a09ab8
8773833,Balón de Fútbol sala talla 4 (perímetro 63 cm) rojo y blanco,Unisex,KIPSTA,,14.99,,False,"Hemos desarrollado este balón para jugadores de fútbol sala que están aprendiendo los gestos técnicos, y que buscan un balón adaptado a su estatura.",4.4,39,blanco nieve,664256e2f8fe2680f3a09ab9
8547127,Balón de baloncesto Talla 7 Tarmak R100 naranja. Perfecto para iniciarte,Unisex,TARMAK,,6.99,,False,"Balón de baloncesto de talla 7 oficial para jugar a baloncesto en exterior o interior, para niños y adultos. Con gran resistencia.",4.6,783,naranja ocaso,664256ebf8fe2680f3a09aba
8604441,Balón de Voleibol Allsix V100 Iniciación Azul,Unisex,ALLSIX,,8.99,,False,Este balón es ideal para quienes se inician en la práctica del voleibol.,4.6,429,,664256f4f8fe2680f3a09abb
8640987,BALÓN DE VOLEIBOL V100 SOFT 260-280 G AZUL/BLANCO A PARTIR DE 15 AÑOS,Unisex,ALLSIX,,11.99,,False,Balón ideal para el aprendizaje de los primeros gestos técnicos del voleibol.,4.6,83,blanco / azul,664256fdf8fe2680f3a09abc
8549565,Balón de vóley playa BV900 FIVB verde y amarillo,Unisex,COPAYA,,34.99,,False,"Nuestro equipo de jugadores de vóley playa se siente orgulloso de haber ideado para ti este balón, ideal para partidos y entrenamientos intensivos.",4.7,11,verde caribeño / amarillo oro fluorescente,66425705f8fe2680f3a09abd
8585384,Balón Fútbol Sala 100 (63cm) Light blanco,Unisex,KIPSTA,,11.99,,False,Hemos desarrollado este balón más ligero para jugadores de fútbol sala que están aprendiendo los gestos técnicos y buscan un balón adaptado a sus necesidades.,4.6,9,blanco nieve,6642570ff8fe2680f3a09abe
8623709,Balón de Fútbol Tango Rosario adidas,Unisex,ADIDAS,,18.99,27.99,True,"Concebido para los entrenamientos y los partidos, asegura unas prestaciones de alto nivel sobre el terreno.",4.2,44,,66425718f8fe2680f3a09abf
8821159,Balón de balonmano Talla 0 - H100 LIGHT violeta,Unisex,KIPSTA,,14.99,,False,Nuestro equipo ha diseñado este balón de balonmano para jóvenes jugadores nivel iniciación que buscan un balón para el aprendizaje del rebote y de los primeros gestos.,5.0,5,violeta intenso / lavanda fluorescente / lila,66425720f8fe2680f3a09ac0
8648076,Balón de baloncesto BT100 de talla 7 naranja para hombres desde 13 años,Unisex,TARMAK,,16.99,,False,"Balón baloncesto talla 7 oficial, adecuado para jugar al baloncesto en exterior y/o en interior, para niños y hombres a partir de 13 años, según reglas FIBA",4.7,61,,66425729f8fe2680f3a09ac1
8741009,Balón de baloncesto NBA talla 7 - Wilson Team Tribute S7 Azul Blanco,Unisex,WILSON,,21.99,29.99,True,"Balón de baloncesto con los colores de los equipos de la NBA, talla 7, ideal para los jugadores de baloncesto en interior y/o en exterior, para niños/adultos.",4.9,13,,66425732f8fe2680f3a09ac2
8774096,Balón de fútbol de espuma Ballground 500 T4 rojo y negro,Unisex,KIPSTA,,11.99,,False,Hemos desarrollado el balón Ballground para el aprendizaje del fútbol en todo tipo de terrenos. Confort incomparable para una máxima satisfacción.,4.6,121,rojo / negro,6642573af8fe2680f3a09ac3
8563502,Balón Fútbol Sala Imviso FS100 58 cm (talla 3) naranja,Unisex,KIPSTA,,9.99,,False,"Hemos desarrollado este balón para jugadores de fútbol sala que están aprendiendo los gestos técnicos, y que buscan un balón adaptado a su estatura.",4.8,18,rojo fluorescente,66425742f8fe2680f3a09ac4
8821160,Balón de balonmano Talla 1 - H100 LIGHT naranja,Unisex,KIPSTA,,14.99,,False,Nuestro equipo ha diseñado este balón de balonmano para jóvenes jugadores nivel iniciación que buscan un balón para el aprendizaje del rebote y de los primeros gestos.,4.0,1,calabaza pastel fluorescente / azul báltico / burdeos,6642574bf8fe2680f3a09ac5
8853512,Balón de baloncesto talla 6 - R500 violeta turquesa,Unisex,TARMAK,,14.99,,False,"Balón de baloncesto de talla 6 oficial, adaptado para jugar al baloncesto en exterior y en interior (niñas/mujeres a partir de 11 años y niños de 11 a 12 años).",4.6,241,,66425754f8fe2680f3a09ac6
8602095,BALÓN DE VOLEIBOL V100 SOFT 230-250 G AZUL/NARANJA PARA NIÑOS 10-14 AÑOS,Unisex,ALLSIX,,11.99,,False,"Balón pedagógico, ideal para el aprendizaje del voleibol. Para cada tramo de edad, estos balones tienen un peso distinto para facilitar el aprendizaje.",4.4,50,,6642575df8fe2680f3a09ac7
8324591,Balón Voleibol Molten 5000 Verde Rojo,Unisex,MOLTEN,,75.99,79.99,True,"Este balón de voleibol ha sido concebido para entrenamientos y competiciones. Balón certificado, cumple las normas para campeonatos regionales y provinciales.",5.0,4,verde / rojo / blanco,66425766f8fe2680f3a09ac8
8796499,Balón de baloncesto niño BT500 TOUCH T5,Unisex,TARMAK,,24.99,,False,"Balón de baloncesto de la talla 5 para jugar en exterior o en interior, para niños y niñas de 7 a 10 años.",4.5,38,verde / azul / naranja,66425770f8fe2680f3a09ac9
8816710,Balón de vóley playa - BV100 classic talla 5 - colorido,Unisex,COPAYA,,8.99,,False,"Balón desarrollado por nuestros equipos de diseño para el nivel iniciación y la práctica de ocio del vóley playa, en familia o entre amigos.",5.0,7,azul,66425779f8fe2680f3a09aca
8753531,Balón de fútbol Sunny 300 talla 4 naranja,Unisex,KIPSTA,,4.49,,False,"Nuestros diseñadores futbolistas han desarrollado el balón Sunny 300 para los más pequeños que empiezan a regatear, chutar o juguetear con el balón.",4.5,872,naranja,66425781f8fe2680f3a09acb
8600233,Balón Fútbol Espuma Imviso talla 1 zul,Unisex,KIPSTA,,3.99,,False,Hemos desarrollado este balón para que los más pequeños se familiaricen con los primeros movimientos técnicos del fútbol sala con total seguridad.,4.7,243,,6642578af8fe2680f3a09acc
89d3de5a-9d33-42fd-976e-761f14e7928f_c20.c14,Balón de baloncesto Molten B5G3800 Talla 5,Unisex,MOLTEN,,54.95,,False,"Diseñado en color marrón, de construcción laminada y cuenta con la homologación FIBA. Compuesto por 12 paneles y una cámara interior de butilo que mantiene la presión del aire evitando su perdida.",,0,naranja / rojo / rojo,66425793f8fe2680f3a09acd
8676298,Balón de fútbol First Kick talla 5 (jugadores de 12 años o más) amarillo,Unisex,KIPSTA,,5.49,,False,"Hemos concebido y desarrollado este balón para jóvenes futbolistas que se inician en el fútbol, o que juegan ocasionalmente.",4.4,1697,amarillo,6642579bf8fe2680f3a09ace
8641261,Balón Baloncesto 3x3 Tarmak BT500 Talla 6 con peso de Talla 7,Unisex,TARMAK,,24.99,,False,"Balón de baloncesto de la talla 6 oficial, adecuado para jugar al baloncesto 3x3 en exterior y/o en interior.",4.4,23,,664257a4f8fe2680f3a09acf
8790034,Balón de fútbol Hybride FIFA BASIC CLUB BALL talla 5 blanco,Unisex,KIPSTA,,14.99,,False,"Homologado por la FIFA para los entrenamientos y las competiciones, hemos diseñado el CLUB HÍBRIDO, un balón que combina una buena comodidad de uso con una gran durabilidad.",4.9,22,blanco nieve,664257aff8fe2680f3a09ad0
8753538,Balón de fútbol Light LEARNING BALL AMARILLO ROSA TALLA 5,Unisex,KIPSTA,,9.99,,False,"Hemos diseñado específicamente este balón LEARNING BALL para los niños. Es más ligero que un balón de fútbol tradicional, lo que facilita el aprendizaje.",4.4,368,amarillo sol,664257b7f8fe2680f3a09ad1
8602094,BALÓN DE VOLEIBOL V100 SOFT 200-220 G AZUL/AMARILLO PARA NIÑOS 6-9 AÑOS,Unisex,ALLSIX,,11.99,,False,"Balón pedagógico, ideal para el aprendizaje del voleibol. Para cada tramo de edad, estos balones tienen un peso distinto para facilitar el aprendizaje.",4.3,113,,664257c0f8fe2680f3a09ad2
c01d6e55-7891-44ae-bead-384f5ca1fea4_c20,Balón de baloncesto Spalding LayUp TF-50,Unisex,SPALDING,,23.99,,False,"Gracias a su excelente durabilidad y resistencia, así como a sus buenas características técnicas, es el balón perfecto para el juego recreativo en campos al aire libre.",5.0,1,naranja,664257caf8fe2680f3a09ad3
8845027,Balón de baloncesto Wilson FIBA 3X3 OFFICIAL FIBA,Unisex,WILSON,,35.99,39.99,True,Entrenamiento o competicion de la más alta exigencia para la práctica del baloncesto 3x3 en exterior o en interior,5.0,2,,664257d3f8fe2680f3a09ad4
8853511,Balón de baloncesto talla 5 - R500 Rosa Negro,Unisex,TARMAK,,14.99,,False,"Balón de baloncesto de talla 5 oficial, adecuado para jugar en exterior o en interior, para niños y niñas de 7 a 10 años.",4.6,135,,664257dbf8fe2680f3a09ad5
8648074,"Balón baloncesto BT100 talla 5 naranja para niños hasta 10 años, para iniciarse.",Unisex,TARMAK,,16.99,,False,"Balón de baloncesto de talla 5 oficial, adecuado para jugar en exterior o en interior, para niños y niñas de 7 a 10 años.",4.9,24,,664257e3f8fe2680f3a09ad6
8625753,Balón de baloncesto talla 7 - SP Molten B7G 4500 Naranja,Unisex,MOLTEN,,76.49,79.99,True,"Concebido para jugadores de baloncesto, para las competiciones en el interior.",4.8,6,,664257ecf8fe2680f3a09ad7
8579041,Balón de Rugby Offload R100 Training Talla 5 Azul,Unisex,OFFLOAD,,14.99,,False,Hemos desarrollado este balón para los entrenamientos en el campo del equipo local o en club. Disponible en T. 5 para niños mayores de 15 años.,4.6,22,blanco nieve / azul marino claro,664257f5f8fe2680f3a09ad8
8774094,Balón de fútbol Ballground 100 azul/azul,Unisex,KIPSTA,,6.99,,False,Hemos desarrollado el balón Ballground 100 para disfrutar jugando al fútbol en cualquier terreno de juego.,4.3,188,azul nube / negro,664257fdf8fe2680f3a09ad9
b785bb0f-8a17-44fc-b354-f897935c6ec6_c20,Balón baloncesto Molten BG3800,Unisex,MOLTEN,,54.95,,False,"Aprobado por la FIBA, este balón es adecuado para suelos sintéticos de todo tipo y suelos de parquet.",,0,naranja / naranja / naranja,66425806f8fe2680f3a09ada
8648081,Balón de baloncesto adulto BT500 Grip talla 7 - Marrón Naranja,Unisex,TARMAK,,29.99,,False,"Talla oficial 7 de baloncesto diseñado para jugar en interiores o en exteriores, para adultos, y niños a partir de 13 años.",4.7,133,,6642580ef8fe2680f3a09adb
8648079,Balón de baloncesto FIBA talla 6 - BT500 Touch Naranja,Unisex,TARMAK,,24.99,,False,"Balón de baloncesto de talla 6, adecuado para jugar en el exterior y/o en el interior, para niñas/mujeres a partir de 11 años y niños de 11 a 12 años.",4.8,31,,66425817f8fe2680f3a09adc
8753534,Balón de fútbol Softball XLight talla 5 290 gramos azul,Unisex,KIPSTA,,8.49,,False,Nuestros ingenieros han desarrollado el Softball para el aprendizaje del fútbol. Balón muy ligero para que los más pequeños se inicien en el fútbol cómodamente.,4.4,179,,6642581ff8fe2680f3a09add
8648082,Balón de baloncesto talla 7 - BT500 FIBA - Marrón,Unisex,TARMAK,,24.99,,False,"Balón de baloncesto de talla 7, adecuado para jugar al baloncesto en exterior y/o en interior, para niños y hombres a partir de 13 años según las reglas FIBA.",4.6,231,,66425828f8fe2680f3a09ade
8591171,Balón EuroLeague Spalding TF1000 Talla 7,Unisex,SPALDING,,76.99,85.0,True,Balón de baloncesto SPALDING TF1000 EUROLEAGUE de talla 7 oficial homologado FIBA para niños y hombres a partir de 13 años en competición en interior.,4.6,7,,66425831f8fe2680f3a09adf
8734568,Balón de fútbol sala Club FIFA Basic,Unisex,KIPSTA,,19.99,,False,"Hemos desarrollado este balón para jugadores de fútbol sala que practican tanto en parquet y PVC como en superficies más abrasivas (asfalto, cemento).",4.5,41,amarillo limón fluorescente / blanco nieve,6642583af8fe2680f3a09ae0
8648075,Balón de baloncesto Talla 6 - BT100 Touch Marrón,Unisex,TARMAK,,16.99,,False,"Balón de baloncesto de talla 6 oficial, adecuado para jugar al baloncesto en exterior o interior, para niños de 11 a 12 años y niñas a partir de 11 años",4.3,17,,66425842f8fe2680f3a09ae1
8618595,Balón Baloncesto Tarmak R500 Talla 7 Rojo,Unisex,TARMAK,,14.99,,False,"Balón baloncesto talla 7 oficial, adecuado para jugar al baloncesto en exterior y/o en interior, para jugadores hombres a partir de 13 años, según reglas FIBA.",4.5,378,,6642584bf8fe2680f3a09ae2
816f8b31-e155-4d7d-9266-7df0c39682b4_c20.c197.c30,Balón de baloncesto Molten B6G3800 Talla 6,Unisex,MOLTEN,,54.95,,False,"Diseñado en color marrón, de construcción laminada y cuenta con la homologación FIBA. Compuesto por 12 paneles y una cámara interior de butilo que mantiene la presión del aire evitando su perdida.",,0,naranja / naranja / beige,66425854f8fe2680f3a09ae3
c57c16eb-dbdc-486e-a989-6c637da748ff_c22.c5,Balón de baloncesto Wilson FIBA 3X3 Replica,Unisex,WILSON,,27.95,,False,Balón de baloncesto Wilson Replica FIBA 3x3 confeccionado para continuar con el aspecto y la sensación similar a los del balón oficial de baloncesto FIBA 3x3,,0,amarillo / azul,6642585df8fe2680f3a09ae4
8668646,BALÓN DE FÚTBOL ESPAÑA TALLA 5 2024,Unisex,KIPSTA,,11.99,,False,Concebido para los futbolistas que quieren jugar de forma ocasional con un balón que luzca los colores de su país o de su equipo favorito.,4.0,5,,66425866f8fe2680f3a09ae5
8604444,BALÓN DE VOLEIBOL OUTDOOR VBO500 AZUL OSCURO Y AMARILLO,Unisex,ALLSIX,,19.99,,False,Este balón ha sido diseñado para la práctica del voleibol en exteriores y es perfecto para tus sesiones de entrenamiento al aire libre.,4.0,25,,6642586ef8fe2680f3a09ae6
8649589,Balón de vóley playa 100 Classic cosido Talla 3 s Verde Totem,Niño,COPAYA,,6.99,,False,"Nuestro equipo de diseño ha creado este balón talla 3 para el nivel iniciación y la práctica de ocio del vóley playa, para niños a partir de 6 años.",4.6,54,menta pastel,66425877f8fe2680f3a09ae7
8733233,"Balón de voleibol V500 gris, azul y rojo",Unisex,KIPSTA,,17.99,,False,¿Eres un(a) jugador(a) de nivel perfeccionamiento y controlas la mayoría de los gestos técnicos? ¡Este balón de voleibol es perfecto para ti!,4.4,143,gris niebla,66425880f8fe2680f3a09ae8
8734255,Balón de Baloncesto Tarmak K500 Aniball s Iniciación Rojo Azul,Niño,TARMAK,,14.99,,False,Balón de baloncesto adecuado para jugar en exterior/interior. Este balón de baloncesto de talla 4 es adecuado para niños y niñas de 4 a 7 años.,4.7,144,azul / rojo intenso,66425889f8fe2680f3a09ae9
8649591,BALÓN DE VÓLEY PLAYA RÉPLICA HÍBRIDO 500 AMARILLO AZUL,Unisex,COPAYA,,16.99,,False,"Desarrollado por nuestros equipos, nuestro balón de vóley playa te acompaña durante tus entrenamientos y partidos.",4.6,108,,66425892f8fe2680f3a09aea
8809227,BALÓN DE FÚTBOL PLAYA HÍBRIDO LIGHT TALLA 5 BLANCO / NARANJA,Unisex,KIPSTA,,16.99,,False,Hemos diseñado este balón de fútbol playa light para niños. Es más ligero para facilitar el aprendizaje del fútbol playa a nivel de club o de ocio.,,0,blanco / naranja,6642589bf8fe2680f3a09aeb
8734249,Balón de baloncesto talla 3 niño - K500 Rubber azul rojo,Unisex,TARMAK,,9.99,,False,"Balón de baloncesto de talla 3 adecuado para jugar en exterior o en interior, para niños de entre 4 y 6 años.",4.8,125,,664258a3f8fe2680f3a09aec
8841164,BALÓN DE RUGBY NIÑO - R100 INICIACIÓN TALLA 3 AMARILLO,Unisex,OFFLOAD,,9.99,,False,Nuestros equipos han desarrollado este balón ligero para la iniciación al rugby. Es de talla 3 (de 5 a 9 años). ¡Los niños marcarán sus primeros ensayos!,5.0,4,amarillo plátano / smoked black,664258acf8fe2680f3a09aed
8812730,Balón de fútbol playa Puma Naranja,Unisex,PUMA,,19.99,,False,Diseñado para la práctica del fútbol playa.,5.0,8,naranja,664258b5f8fe2680f3a09aee
8790029,Balón de fútbol híbrido FIFA BASIC CLUB BALL talla 4 blanco,Unisex,KIPSTA,,14.99,,False,"Homologado por la FIFA para los entrenamientos y las competiciones, hemos diseñado el CLUB HÍBRIDO, un balón que combina una buena comodidad de uso con una gran durabilidad.",5.0,9,blanco nieve,664258bdf8fe2680f3a09aef
8753544,Balón de fútbol Light LEARNING BALL AZUL VEET VIOLETA TALLA 4,Unisex,KIPSTA,,9.99,,False,Hemos diseñado el balón LEARNING BALL específicamente para los niños. Es más ligero que un balón de fútbol tradicional para facilitar el aprendizaje,4.5,84,blanco nieve,664258c6f8fe2680f3a09af0
8855483,Balón de baloncesto NBA talla 7 - Wilson Team Tribute Chicago Bulls,Unisex,WILSON,,22.99,29.99,True,"Balón de baloncesto con los colores de los Bulls de Chicago de la NBA, talla 7, para niños y adultos, ideal para jugar al baloncesto en interior y/o en exterior.",5.0,1,,664258cff8fe2680f3a09af1
8747322,Balón baloncesto NBA talla 7 - NBA OFFICIAL GAME BALL Marrón,Unisex,WILSON,,195.99,,False,Este balón ha sido concebido para el baloncesto de competición.,,0,,664258d7f8fe2680f3a09af2
8804087,Balón de Rugby Talla 5 España,Unisex,OFFLOAD,,14.99,,False,Este balón se ha diseñado para los entrenamientos.Disponible T5 mayores de 15 años en el color de tu selección para mostrar tu apoyo.,,0,rojo fluo / amarillo sol,664258e0f8fe2680f3a09af3
9a0c0df7-2a3d-4b75-b275-37413ff4c558_c255,Balón de baloncesto Molten B5R2 Talla 5,Unisex,MOLTEN,,14.9,18.9,True,"El Balón de baloncesto Molten B5R2 Talla 5 está confeccionado con caucho de alta calidad, compuesto por ocho paneles y cámara interior de butilo. Recomendado para uso interior y exterior.",,0,multicolor,664258e8f8fe2680f3a09af4
8497543,Balón Balonmano Playa Atorka HB500B Talla 2 Rojo,Unisex,ATORKA,,6.99,,False,"Los equipos de diseño han ideado un balón de balonmano playa, adherente y resistente, perfecto para jugar en la playa.",4.3,3,,664258f1f8fe2680f3a09af5
8821975,Balón de Fútbol ORBITA Serie A 23/24 PUMA,Unisex,PUMA,,23.49,34.99,True,Concebido para maximizar tu rendimiento el día del partido.,4.5,15,,664258faf8fe2680f3a09af6
8858400,Balón de fútbol Borussia Dortmund Talla 5,Unisex,PUMA,,18.99,24.99,True,"Juega como si lo hicieras en el «Muro Amarillo» con este balón T5 con los colores del Borussia Dortmund, perfecto para tus entrenamientos y partidos.",,0,,66425902f8fe2680f3a09af7
8545796,Balón Fútbol Sala Imviso FS100 52 cm (talla 2),Unisex,KIPSTA,,7.99,,False,"Hemos desarrollado este balón para jugadores de fútbol sala que están aprendiendo los gestos técnicos, y que buscan un balón adaptado a su estatura.",4.0,6,amarillo fluorescente,66425916f8fe2680f3a09af8
8826051,Balón de balonmano talla 0 - H100 SOFT iniciación PVC naranja,Unisex,KIPSTA,,4.99,,False,"El equipo de diseño ha concebido un balón ideal para iniciarse en la práctica del balonmano, para jóvenes jugadores y jugadoras en iniciación.",4.2,5,calabaza pastel fluorescente / blanco nieve,6642591ef8fe2680f3a09af9
8368090,Balón de Rugby Gilbert GTR 4000 Talla 5 Blanco y Negro,Unisex,GILBERT,,23.49,24.99,True,Este balón de rugby ha sido diseñado para practicar durante los entrenamientos (de 1 a 3 veces por semana). Escogido por su agarre y su resistencia.,4.9,15,blanco / negro,66425927f8fe2680f3a09afa
8794859,Balón de fútbol americano Super Bowl adulto - NFL 32 TEAMS OFICIAL Marrón,Unisex,WILSON,,21.99,29.99,True,Balón de fútbol americano de cuero con los colores de las 32 franquicias de la NFL,4.5,6,,66425930f8fe2680f3a09afb
8811478,BALÓN DE FÚTBOL PLAYA BS Pro HÍBRIDO TALLA 5 ROJO / NARANJA,Unisex,KIPSTA,,29.99,,False,"Hemos desarrollado este balón para la práctica del fútbol playa en competición, partidos y entrenamientos.",,0,rojo / naranja,66425938f8fe2680f3a09afc
8772251,BALÓN DE VOLEIBOL DE ESPUMA AZUL,Unisex,ALLSIX,,5.99,,False,Hemos diseñado este balón para todos aquellos que quieran familiarizarse con los primeros gestos del voleibol fácilmente y con total confianza.,4.6,68,,66425940f8fe2680f3a09afd
b76bcfca-025f-4aed-9bcd-53a9ea59fe67_c112.c20.c5,Baloncesto pista cubierta y al aire libre All Conference Naranja,Unisex,SPALDING,,24.95,,False,Baloncesto en pista cubierta y al aire libre,,0,calabaza / naranja / azul,66425949f8fe2680f3a09afe
90d95cb4-fa14-496c-acca-a483b0bf3557_c27,Balón fútbol de la NFL Wilson Officiel NFL DUKE New,Unisex,WILSON,,184.0,,False,"El balón Duke NFL encarna ahora, de la manera más auténtica posible, este balón icónico que ha estado en manos de los mejores jugadores desde que la NFL comenzó en 1941.",,0,marrón / marrón / marrón,66425952f8fe2680f3a09aff
8619218,Balón de fútbol Híbrido FIFA BASIC F500 talla 5 blanco amarillo,Unisex,KIPSTA,,11.99,,False,"Homologado por la FIFA para entrenamientos y competiciones, hemos concebido el F500 Híbrido, un balón que combina comodidad de uso y resistencia.",4.5,1167,blanco nieve,6642595bf8fe2680f3a09b00
c7c02f4a-0d0c-4ef9-9495-4538b56cdf2b_c27.c20,Balón baloncesto Molten BG5000,Unisex,MOLTEN,,140.0,,False,"Ideal para competiciones de alto nivel o regulares, este balón de baloncesto de gama alta de Molten ofrece un nuevo tacto excepcional gracias a su cuero de tacto suave de nuevo diseño",,0,marrón / naranja / naranja,66425963f8fe2680f3a09b01
8853543,Balón de baloncesto talla 6 - Resist 900 amarillo negro,Unisex,TARMAK,,19.99,,False,Balón de baloncesto de talla 6 ultrarresistente adecuado para jugar a baloncesto en exterior para niñas/mujeres a partir de 11 años y niños de 11 a 12 años.,4.0,1,,6642596cf8fe2680f3a09b02
8881753,Balón de balonmano Talla 1 - Select LNH23 réplica negro/amarillo,Unisex,SELECT,,29.49,,False,El balón Réplica es el balón ideal para entrenamientos y partidos de balonmano.,,0,,66425975f8fe2680f3a09b03
8733516,Balón de Fútbol Street Barrio,Unisex,KIPSTA,,16.99,,False,"Concebido para los jugadores de fútbol callejero o Fútbol Street que juegan en terrenos duros y abrasivos (asfalto, hormigón, hierba sintética corta, moqueta)",4.7,26,gris nube,6642597df8fe2680f3a09b04
8619213,Balón de fútbol Híbrido FIFA BASIC F550 talla 5 blanco rojo,Unisex,KIPSTA,,16.99,,False,"Homologado por la FIFA para entrenamientos y competiciones, hemos concebido el F550 Híbrido con una excelente combinación de resistencia y sensaciones de juego",4.4,231,blanco nieve,66425985f8fe2680f3a09b05
8827905,"Balón fútbol Termosellado FIFA QUALITY PRO, PRO BALL talla 5 blanco",Unisex,KIPSTA,,44.99,,False,"Homologado FIFA QUALITY PRO para entrenamientos y competiciones, hemos concebido el PRO BALL para cumplir con los requisitos del más alto nivel en competición.",3.0,2,blanco nieve,6642598ef8fe2680f3a09b06
8579036,Balón De Rugby Offload R300 Talla 4 Rojo,Unisex,OFFLOAD,,14.99,,False,Hemos desarrollado este balón para los entrenamientos en el campo del equipo local o en club. Disponible en T. 4 para jóvenes de 10 a 14 años.,4.3,26,blanco nieve / rojo intenso,66425997f8fe2680f3a09b07
8790043,BALÓN DE FÚTBOL HÍBRIDO CLUB BALL LIGHT TALLA 4 BLANCO,Unisex,KIPSTA,,14.99,,False,Hemos concebido este balón CLUB BALL LIGHT para los niños.Es más ligero para facilitar el aprendizaje del fútbol a nivel de club.,,0,blanco nieve,664259a0f8fe2680f3a09b08
63d1b424-6798-48b4-9674-dee80c62078a_c20,Balón baloncesto Molten BG3200 T7,Unisex,MOLTEN,,64.0,,False,"Este balón de entrenamiento de cuero sintético, aprobado por la FFBB, tiene una vejiga de butilo que garantiza una buena retención de aire, una redondez perfecta y un rebote óptimo.",,0,naranja / naranja / naranja,664259a9f8fe2680f3a09b09
bd286061-520a-4713-9834-a8007b9b6e00_c20,Balón baloncesto Molten BG3800,Unisex,MOLTEN,,70.0,,False,"Aprobado por la FIBA, este balón es adecuado para suelos sintéticos de todo tipo y suelos de parquet.",5.0,1,naranja / naranja / naranja,664259b1f8fe2680f3a09b0a
8834379,Balón de balonmano Talla 2 - SELECT MUNDO naranja,Unisex,SELECT,,20.49,,False,El balón Mundo es el balón ideal para entrenamientos y partidos de balonmano.,,0,,664259baf8fe2680f3a09b0b
8746957,Balón de baloncesto NBA talla 7 - Wilson Signature Series S7 naranja,Unisex,WILSON,,59.99,,False,"El balón de baloncesto Wilson NBA SIGNATURE SERIES (talla 7) es ideal para jugar a baloncesto en interior y/o en exterior, para niños y adultos.",3.9,13,,664259c2f8fe2680f3a09b0c
8648083,"Balón de baloncesto BT900 talla 6, homologado FIBA para niñas, niños y mujeres",Unisex,TARMAK,,39.99,,False,Balón de baloncesto de talla 6 adecuado para jugar en exterior/interior (niñas y mujeres a partir de 11 años y niños de 11 a 12 años) - Homologado FIBA.,4.8,6,,664259cbf8fe2680f3a09b0d
8741080,Balón de baloncesto NBA talla 7 - Wilson Team Tribute Lakers violeta negro,Unisex,WILSON,,29.99,,False,"Balón de baloncesto con los colores de Los Angeles LAKERS NBA, talla 7, ideal para los jugadores de baloncesto en interior y/o en exterior, para niños/adultos.",4.5,14,,664259d3f8fe2680f3a09b0e
