id,name,genre,brand,sticker,price,previous_price,discount,description,rating,n_reviews,color,_id
7b3c26c4-966b-4262-ad4b-9cb4317e70ee_c4.c14.c5,Balón rugby Gilbert USA,Unisex,GILBERT,,34.0,,False,"El balón réplica de Estados Unidos es una réplica exacta del que se utiliza en los partidos oficiales, lo que le convierto en el producto perfecto para mostrar tu apoyo a tu equipo favorito.",,0,blanco / rojo / azul,66425ff3f8fe2680f3a09bc0
6c38d4cf-da1a-4420-b479-dc4f95b0fead_c20,Balón baloncesto Molten BG2010 T5,Unisex,MOLTEN,,34.0,,False,Esta pelota de baloncesto de alta calidad se adapta a todos los niveles de juego y se puede utilizar tanto en interiores como en exteriores,,0,naranja / naranja / naranja,66425ffbf8fe2680f3a09bc1
454e9261-b872-4398-957f-3dcf1eac6c45_c4.c5.c1,Balón rugby Gilbert Uruguay,Unisex,GILBERT,,34.0,,False,"El balón réplica de Uruguay es una réplica exacta del balón utilizado en los partidos oficiales, lo que lo convierte en el producto perfecto para mostrar tu apoyo a tu equipo favorito.",,0,blanco / azul / negro,66426004f8fe2680f3a09bc2
e6f75436-3add-4974-9318-b37218d2314d_c5,Balón de baloncesto du Baskonia Vitoria Gasteiz Spalding,Unisex,SPALDING,,34.0,,False,Réplica del globo FC Barcelona / Turkish Airlines Euroliga,,0,azul,6642600cf8fe2680f3a09bc3
2ca97a94-0c48-4cd8-8c1f-8be020f32c53_c255.c249.c86,Balón entrenamiento UCL 23/24 Group Stage Foil,Unisex,ADIDAS,,39.99,,False,Entrena como los profesionales,,0,multicolor / plateado / azul cian,66426015f8fe2680f3a09bc4
f74c4b53-5159-4990-87d7-7f7fda892dab_c20.c1,Balón de baloncesto All Court 3.0,Unisex,ADIDAS,,40.0,,False,Anota tus mejores tantos,,0,naranja / negro,6642601df8fe2680f3a09bc5
cbfa961e-e1e8-4694-b8d3-b1a23d1c86b3_c255.c14.c5,Balón de Baloncesto Spalding Marble Series Rainbow Talla 7,Unisex,SPALDING,,32.95,34.95,True,"Su diseño con mezcla de colores única y su excelente durabilidad, lo convertirán en el rey de las pistas outdoor.",,0,multicolor / rojo / azul,66426026f8fe2680f3a09bc6
c6c8e563-6406-4938-bde2-76c430c0cb3f_c4,Balón de rugby Gilbert Emblema de la Copa del Mundo 2023,Unisex,GILBERT,,32.0,,False,"Este balón lleva los logotipos de los 20 países participantes, celebrando así la unidad mundial del rugby.",,0,blanco,6642602ff8fe2680f3a09bc7
ed12edb9-ae2b-4edd-bddd-b9b804e5ab41_c20.c1,Baloncesto de espuma - Tamaño 2 (diámetro: 14cm),Unisex,POWER SHOT,,31.99,35.0,True,"Inicie a sus hijos en el baloncesto con total seguridad. Pelota de espuma suave con un diámetro de 14 cm. Perfecto para colegios, servicios extraescolares o familias 🏀",,0,naranja / negro,66426038f8fe2680f3a09bc8
8668619,Balón de fútbol talla 1 Kipsta Bélgica 2022,Unisex,KIPSTA,,7.99,,False,Concebido para los futbolistas que quieren jugar de forma ocasional con un balón que luzca los colores de su país o de su equipo favorito.,5.0,1,blanco / rojo / negro,66426040f8fe2680f3a09bc9
04929857-aeb7-4f35-a91e-bf6343006523_c255.c22,Balón de fútbol de training Orbita LaLiga Hybrid PUMA,Unisex,PUMA,,38.3,45.62,True,"Entra en el campo de entrenamiento como las estrellas de La Liga con nuestro Orbita La Liga 1 Hybrid, la réplica del balón de entrenamiento de la liga española. Diseñado con el ADN deportivo de PUMA.",,0,multicolor / amarillo,66426048f8fe2680f3a09bca
6ccbd317-a4b2-4d40-a764-a32aaa3013a7_c9.c20,Balón Handball Select Mundo V22,Unisex,SELECT,,31.0,,False,"Fabricado en piel sintética resistente, este balón de entrenamiento cosido a mano garantiza la comodidad en la mano. Su interior de vejiga Zero-Ply garantiza una redondez óptima.",,0,verde / naranja / verde,66426051f8fe2680f3a09bcb
a07ea538-95c3-43bd-bd02-8ba8890be761_c4.c255,Balón de fútbol NEYMAR JR Graphic PUMA White Multicolor,Unisex,PUMA,,28.9,,False,"Al pensar en Neymar, piensas automáticamente en su estilo. Con el balón NEYMAR JR Graphic, exhibirás ese mismo estilo de juego en el parque, el patio o la calle. Diseñado con el ADN deportivo de PUMA.",,0,blanco / multicolor,66426059f8fe2680f3a09bcc
9cff3594-c863-4c8c-8999-4d03786ca658_c20.c11,Balón Handball Select Mundo V22,Unisex,SELECT,,31.0,,False,"Fabricado en piel sintética resistente, este balón de entrenamiento cosido a mano garantiza la comodidad en la mano. Su interior de vejiga Zero-Ply garantiza una redondez óptima.",,0,naranja / verde claro,66426062f8fe2680f3a09bcd
2d436471-67ff-4027-a1e5-decdf1e28a15_c9.c4,Balonmano Select Light Grippy DB V22 Verde,Unisex,SELECT,,31.0,,False,Fabricada en piel sintética extraligera y flexible. Una bandeja SR especialmente fabricada en el interior garantiza una redondez óptima. Tamaño: Doble 0,,0,verde / blanco / blanco,6642606bf8fe2680f3a09bce
b3bcb9f2-c3e4-4694-a7de-0f1823da19ba_c5.c4,Balonmano Select Light Grippy DB V22,Unisex,SELECT,,31.0,,False,Fabricado en piel sintética extra ligera y suave. Una bandeja SR especialmente construida en el interior garantiza una redondez óptima.,,0,azul / blanco / blanco,66426073f8fe2680f3a09bcf
dc9d98e6-3fbe-4d32-9f5f-df241e15f2fa_c24.c4,Balonmano Select Light Grippy DB V22 Rosa,Unisex,SELECT,,36.99,,False,Fabricado en piel sintética extra ligera y suave. Una bandeja SR especialmente construida en el interior garantiza una redondez óptima.,,0,rosa / blanco / blanco,6642607cf8fe2680f3a09bd0
7977c319-96ae-4cf3-a81c-dbe7ae0aa1b6_c1.c5,Balón de Futbol Entrenamiento para Asfalto PU Engomado Nº5 STREET FIGHTER,Unisex,INDIGO SPORTS,,30.99,,False,Balón de Futbol Entrenamiento para Jugar en Asfalto PU Engomado Nº5 STREET FIGHTER INDIGO Negro- Azul,,0,negro / azul,66426085f8fe2680f3a09bd1
8766424,Balón de rugby talla 5 - Gilbert Réplica Francia blanco azul rojo,Unisex,GILBERT,,30.99,34.99,True,"Para la práctica regular del rugby, tanto en entrenamiento como en competición.",4.9,13,,6642608df8fe2680f3a09bd2
83cd8d88-0713-48dc-ba75-083cda787829_c255,Balonmano de entrenamiento y competición,Unisex,GLADIATORFIT,,40.0,,False,Balonmano de entrenamiento y competición,,0,multicolor,66426096f8fe2680f3a09bd3
bf7971ba-9e87-4747-96ce-41d0697c9e58_c8.c22.c24,Balón de fútbol con gráfico Neymar Jr PUMA,Unisex,PUMA,,29.9,,False,Juega como el rey del campo con este balón Neymar Jr. Diseñado con el ADN deportivo de PUMA.,,0,azul oscuro / amarillo / rosa,6642609ff8fe2680f3a09bd4
8394289,Balón de Rugby Gilbert Omega Talla 5 Azul,Unisex,GILBERT,,40.99,,False,"Este balón ha sido concebido para jugar al rugby, en entrenamientos y partidos. Primer balón de la gama Gilbert para jugar con el pie.",,0,,664260a7f8fe2680f3a09bd5
f86d9196-91b6-4e24-a2b3-19af9fc9bb55_c1.c5,Balón Baloncesto Wilson MVP AZUL,Unisex,WILSON,,16.95,,False,El balón de baloncesto NCAA MVP cuenta con una construcción de goma de alta calidad para horas de juego. El compuesto de caucho de alta calidad proporciona una excelente durabilidad.,,0,negro / azul / negro,664260b0f8fe2680f3a09bd6
0553f850-899b-4a5f-9620-16764e6a3ddb_c20.c1,Balón de baloncesto TF 150 Turkish Airlines Euroleague T7 Spalding,Unisex,SPALDING,,30.0,,False,construcción de caucho de alto rendimiento,,0,naranja / naranja / negro,664260b8f8fe2680f3a09bd7
e5a47d22-fcdc-4f91-bc64-50e1bf44ffc2_c1,Balón fútbol de la NFL Wilson Raiders de Las Vegas Peewee,Unisex,WILSON,,30.0,,False,"Pelota para aficionados de Los Raiders de Las Vegas. Ligeramente más pequeño que el tamaño adulto, perfecto para los jugadores más jóvenes. Este tamaño generalmente se conoce como PEEWEE.",,0,negro,664260c1f8fe2680f3a09bd8
cee6b8db-d847-4e9e-94dc-eac300c1927c_c4.c1.c5,Balón Fussballliebe League (Adolescentes),Unisex,ADIDAS,,30.0,,False,Alcanza la cumbre del fútbol europeo,,0,blanco / negro / azul,664260caf8fe2680f3a09bd9
b2713da2-c65f-4d25-b33d-d0b7013c06c6_c1.c5,Baloncesto callejero negro fundido,Unisex,MOLTEN,,30.0,,False,Juega como un profesional con la pelota de goma Molten 3X3 Street BC1600 con 8 paneles conformes a la FIBA.,,0,negro / azul / azul,664260d2f8fe2680f3a09bda
7b48f7a1-b327-4f3d-ba0c-114d30802444_c4.c5.c20,Balón UCL League Junior 350 23/24 Knockout,Unisex,ADIDAS,,34.9,,False,Pasión por el fútbol europeo,,0,blanco / azul / naranja,664260dbf8fe2680f3a09bdb
ac42b037-d1ee-4cd4-a395-260e1f8ac6e5_c4.c1,Balón Tango Rosario,Unisex,ADIDAS,,30.0,,False,Rinde homenaje a un mito,,0,blanco / negro / negro,664260e4f8fe2680f3a09bdc
f3909e09-9399-4f21-9674-bd4e369e4802_c255.c4.c24,Balón fútbol Puma Orbita 5 réplica,Unisex,PUMA,,35.0,,False,"A partir de la temporada 2022-2023, este balón se jugará en los principales campeonatos europeos",,0,multicolor / blanco / rosa,664260edf8fe2680f3a09bdd
24405c82-ca12-4111-9e3a-67446f6696cd_c4.c249.c86,Balón UCL Junior 350 League 23/24 Group Stage (Adolescentes),Unisex,ADIDAS,,37.0,,False,Practica tu fútbol más fluido,,0,blanco / plateado / azul cian,664260f5f8fe2680f3a09bde
d021fe07-8bf8-4439-8007-62d071dc001b_c4.c1.c5,Balón entrenamiento Fussballliebe Foil Sala,Unisex,ADIDAS,,30.0,,False,Aduéñate de la pista con tu fútbol más supremo,,0,blanco / negro / azul,664260fef8fe2680f3a09bdf
29ffdde3-53ac-4ad2-8f4d-e1dbb62bffa2_c27,Balon de fútbol de la NFL Wilson des Tampa Bay Buccaneers,Unisex,WILSON,,35.0,,False,"Balón de fútbol americano de tamaño oficial con el logotipo de los Tampa Bay Buccaneers para uso recreativo/de ocio, también adecuado para coleccionistas y aficionados.",,0,marrón / marrón / marrón,66426107f8fe2680f3a09be0
fedbd8fe-2354-4465-b74c-f38609fe648b_c5.c1,Balón de baloncesto NBA DRV Plus Vibe Talla 7,Unisex,WILSON,,30.0,,False,Balón replicó NBA resistente y diseñado para jugar al aire libre.,,0,azul / negro / azul,6642610ff8fe2680f3a09be1
d7cc0d8c-e641-4145-b82f-dc89316cfb94_c27,Balón fútbol de la NFL Wilson des New England Patriots,Unisex,WILSON,,35.0,,False,"Balón de fútbol americano de tamaño oficial con el logotipo de los New England Patriots para uso recreativo/de ocio, también adecuado para coleccionistas y aficionados.",,0,marrón / marrón / marrón,66426118f8fe2680f3a09be2
081ba2df-7824-495b-9544-bef6418cee61_c4.c255,Balón de fútbol PUMA Orbita 5 HYB PUMA White Multi Colour,Unisex,PUMA,,23.95,,False,Un balón de training robusto para sesiones de training habituales. Diseñado con el ADN deportivo de PUMA.,,0,blanco / multicolor,66426121f8fe2680f3a09be3
522652cb-344b-4f98-8f25-ae46d35239c4_c1,Balón fútbol de la NFL Wilson NFL OFFICIEL JET BLACK,Unisex,WILSON,,34.0,,False,El balón Wilson NFL Jet Black cuenta con una cubierta de composite ultra adherente para un contacto y una durabilidad sin precedentes.,,0,negro / negro / negro,6642612af8fe2680f3a09be4
ff5487ac-78c5-444a-bb4c-70e5f7f2a160_c27,Balón fútbol de la NFL Wilson des Raiders de Las Vegas,Unisex,WILSON,,35.0,,False,"Balón de fútbol americano de tamaño oficial con el logotipo de los Raiders de Las Vegas para uso recreativo/de ocio, también adecuado para coleccionistas y aficionados.",,0,marrón / marrón / marrón,66426132f8fe2680f3a09be5
5874541c-f589-401f-b685-60798a669021_c27.c5,Balón fútbol de la NFL Wilson des Indianapolis Colts,Unisex,WILSON,,35.0,,False,"Balón de fútbol americano de tamaño oficial con el logotipo de los Indianapolis Colts para uso recreativo/de ocio, también adecuado para coleccionistas y aficionados.",,0,marrón / azul / marrón,6642613bf8fe2680f3a09be6
b37b7a04-8995-44a7-b725-d8c3b7f55876_c27.c9,Balón fútbol de la NFL Wilson des New York Jets,Unisex,WILSON,,35.0,,False,"Balón de fútbol americano de tamaño oficial con el logotipo de los New York Jets para uso recreativo/de ocio, también adecuado para coleccionistas y aficionados.",,0,marrón / verde / marrón,66426144f8fe2680f3a09be7
f7867484-1f22-4bbd-9aac-1d2e49b19240_c1.c14,Balón baloncesto Wilson NBA Team Tribute - Portland Blazers,Unisex,WILSON,,35.0,,False,"Apoya a tu equipo favorito con el balón Wilson NBA Team Tribute, que presenta un patrón alternado de los colores icónicos del equipo con el logotipo de la franquicia en un lugar destacado.",,0,negro / rojo / negro,6642614df8fe2680f3a09be8
9a89b4b5-0e8c-4a27-a727-9cc8a6e4f3b1_c16.c1,Balón baloncesto Wilson NBA Team Tribute – Sacramento Kings,Unisex,WILSON,,35.0,,False,"Apoya a tu equipo favorito con el balón Wilson NBA Team Tribute, que presenta un patrón alternado de los colores icónicos del equipo con el logotipo de la franquicia en un lugar destacado.",,0,violeta / violeta / negro,66426155f8fe2680f3a09be9
8848971,Balón de balonmano Molten HX3400 FFHB Talla 2,Unisex,MOLTEN,,29.49,,False,Para jugadores de balonmano que quieren un buen balón para entrenamientos y partidos.,4.7,3,,6642615ef8fe2680f3a09bea
8790045,BALÓN DE FÚTBOL HÍBRIDO CLUB BALL X-LIGHT TALLA 5 BLANCO,Unisex,KIPSTA,,14.99,,False,"Hemos diseñado este CLUB BALL X-LIGHT para niños. Es mucho más ligero, lo que facilita el aprendizaje del fútbol en club.",,0,turquesa celeste,66426166f8fe2680f3a09beb
58fb66c7-634c-43d9-bfa6-21116959f9ca_c1.c14.c4,Balón de Baloncesto Spalding Black Red Graffiti Talla 7,Unisex,SPALDING,,29.95,,False,"Su diseño espectacular junto a unas características técnicas excelentes, lo convierten en un balón perfecto para los jugadores amantes del basket.",,0,negro / rojo / blanco,6642616ff8fe2680f3a09bec
0a668e24-faa6-42e4-9992-c256572d7291_c9.c1,Balón de Baloncesto Wilson NBA TEAM TRIBUTE CELTICS Talla 7,Unisex,WILSON,,29.95,,False,Balón de baloncesto ideal para que los fans de los Golden State WARRIORS puedan disfrutar del basket en todo tipo de canchas.,,0,verde / negro,66426178f8fe2680f3a09bed
1540fe9a-c509-499d-8248-f27c89257d73_c255,BALÓN DE BALONCESTO SPALDING CAMUFLAJE TAMAÑO 7,Unisex,SPALDING,,33.95,34.95,True,Destaca en la cancha con el balón de baloncesto Spalding Camuflaje Tamaño 7. Único y resistente para un juego audaz al aire libre.,,0,multicolor,66426181f8fe2680f3a09bee
d09eab78-dfe5-4acb-8daa-6727e03ea655_c5.c8.c1,Balón baloncesto Wilson NBA Team Tribute - Dallas Mavericks,Unisex,WILSON,,31.4,36.28,True,"Apoya a tu equipo favorito con el balón Wilson NBA Team Tribute, que presenta un patrón alternado de los colores icónicos del equipo con el logotipo de la franquicia en un lugar destacado.",,0,azul / azul oscuro / negro,66426189f8fe2680f3a09bef
9601107d-3878-41c9-b00d-1422ab1343c5_c20.c1,Balón de baloncesto Spalding TF-150 Talla 7,Unisex,SPALDING,,32.95,,False,El balón de baloncesto Spalding TF-150 fabricado en caucho puede adaptarse a cualquier cancha y a las condiciones más duras.,,0,naranja / naranja / negro,66426192f8fe2680f3a09bf0
8bcc63fa-02e4-433b-8c4f-c5ee0d729683_c1,Balón de baloncesto SLAM DUNK Black Talla 7,Unisex,SPALDING,,34.95,,False,"Con un diseño sobrio y elegante y una excelente resistencia a la abrasión, es el balón perfecto para los jugadores amateurs que juegan con regularidad.",,0,negro,6642619bf8fe2680f3a09bf1
a379a471-5db6-4bfa-b4f4-55970786e54d_c5.c22,Balón baloncesto Wilson NBA Team Tribute - Golden State Warriors,Unisex,WILSON,,35.0,,False,"Apoya a tu equipo favorito con el balón Wilson NBA Team Tribute, que presenta un patrón alternado de los colores icónicos del equipo con el logotipo de la franquicia en un lugar destacado.",,0,azul / amarillo / amarillo,664261a3f8fe2680f3a09bf2
c54ce64c-1463-410a-86f4-e1991548eb9e_c24.c16.c4,Balón de Baloncesto Spalding COMMANDER SOLID PURPLE PINK Talla 6,Unisex,SPALDING,,34.95,,False,Espectacular diseño y tacto suave para disfrutar de una excelente experiencia de juego.,,0,rosa / violeta / blanco,664261acf8fe2680f3a09bf3
d9519d53-d1f1-44ab-aaea-e1b6076eb92e_c4.c5,Balón baloncesto Spalding du Real de Madrid Euroleague,Unisex,SPALDING,,29.95,,False,Réplica del balón de la Euroliga del Real Madrid / Turkish Airlines,,0,blanco / blanco / azul,664261b4f8fe2680f3a09bf4
79a8eeb6-722d-4254-9d1a-df3adad01eeb_c20.c16,Balón baloncesto Wilson NBA Team Tribute - Phoenix Suns,Unisex,WILSON,,29.95,,False,"Apoya a tu equipo favorito con el balón Wilson NBA Team Tribute, que presenta un patrón alternado de los colores icónicos del equipo con el logotipo de la franquicia en un lugar destacado.",,0,naranja / naranja / violeta,664261bdf8fe2680f3a09bf5
7b838dae-56b3-4b45-98c5-19000a91b336_c20.c27.c1,Balón de baloncesto DRV PRO Wilson,Unisex,WILSON,,37.0,,False,"Con esta pelota, aprovecha el dinamismo que te impulsará al siguiente nivel del juego con su nueva capa de amortiguación y con el máximo agarre en todas las condiciones climáticas.",,0,naranja / marrón / negro,664261c6f8fe2680f3a09bf6
7e4e9ad9-5511-45f8-8c0f-23e9b3cbe1b0_c20,Balón de baloncesto NBA DRV Pro Talla 7 Wilson,Unisex,WILSON,,29.95,,False,"El Balón de Baloncesto NBA DRV Pro Wilson es una excelente opción si se desea una pelota para canchas de exterior, gracias a su cobertura de alto rendimiento que proporciona una sujeción muy alta.",5.0,1,naranja,664261cff8fe2680f3a09bf7
7e23cb8e-3f36-4fce-a0d0-908bcbaed8b2_c5.c20,Balón de baloncesto DRV PRO Streak Wilson T6,Unisex,WILSON,,31.95,,False,"Con esta pelota, aprovecha el dinamismo que te impulsará al siguiente nivel del juego con su nueva capa de amortiguación y con el máximo agarre en todas las condiciones climáticas.",,0,azul / azul / naranja,664261d8f8fe2680f3a09bf8
59aedeb4-2bed-471f-97ed-69cfb7be3c1e_c255,Balón de Baloncesto Spalding Marble Series Black Rainbow Talla 7,Unisex,SPALDING,,34.95,,False,Atractivo diseño y caucho resistente para que te luzcas en cualquier superficie,,0,multicolor,664261e1f8fe2680f3a09bf9
f12760c7-2749-4eaa-bdd9-718d44c3bf23_c197,Balón de baloncesto Spalding Varsity TF-150 Liga ENDESA Talla 7,Unisex,SPALDING,,29.95,,False,Réplica en talla 7 del balón oficial de la Liga Endesa. Apto para superficies Outdoor e Indoor.,,0,naranja,664261e9f8fe2680f3a09bfa
dda85d05-f7cb-4d00-a46b-01c0284cb7c7_c255,Balón de baloncesto Spalding GRAFITTI Orange Talla 7,Unisex,SPALDING,,29.95,,False,"Por su espectacular y colorido diseño y sus excelentes características de juego, se convertirá en la elección perfecta de los jugadores amateurs de baloncesto.",,0,multicolor,664261f2f8fe2680f3a09bfb
81b74f05-3a08-41a8-a369-7f20ab1172e8_c20,Balón baloncesto Spalding du FC Bayern Munich,Unisex,SPALDING,,29.95,,False,Balón réplica del Bayern / Munchen Basketball,,0,naranja,664261faf8fe2680f3a09bfc
3f131063-4163-4c2c-a706-4130e12b567b_c20.c5,Balón baloncesto Spalding du FC Barcelone Euroleague,Unisex,SPALDING,,29.95,,False,Réplica del balón FC Barcelona / Turkish Airlines Euroliga,,0,naranja / naranja / azul,66426203f8fe2680f3a09bfd
c52e4206-9810-47af-ac58-6192db053c06_c5.c195,Balón baloncesto Wilson NBA Team Tribute – Philadelphie 76ers,Unisex,WILSON,,35.0,,False,Esta pelota de baloncesto para todas las franquicias de la NBA ofrece una sensación de nivel profesional y mayor durabilidad.,,0,azul / azul marino / azul,6642620cf8fe2680f3a09bfe
654c9b10-2ee6-4cf3-83ff-c36913d9d158_c20,Balón de baloncesto Spalding TF-150 Talla 6,Unisex,SPALDING,,25.99,,False,El balón de baloncesto Spalding TF-150 fabricado en caucho puede adaptarse a cualquier cancha y a las condiciones más duras.,,0,naranja,66426215f8fe2680f3a09bff
85719ff4-a3af-4590-9720-78943fba8640_c255,Balón de baloncesto Spalding COMMANDER Poly Talla 7,Unisex,SPALDING,,34.95,,False,Espectacular diseño y tacto suave para disfrutar de una excelente experiencia de juego.,,0,multicolor,6642621df8fe2680f3a09c00
cd12383f-17fe-4885-9910-70c2c4281957_c20.c1,Balón de Baloncesto Spalding VARSIRY FIBA TF-150 Talla 7,Unisex,SPALDING,,29.9,,False,"VARSITY TF-150 puede resistir las canchas y condiciones más duras, desde el camino al gimnasio hasta la cancha ¡es hora de jugar!",,0,naranja / negro,66426226f8fe2680f3a09c01
9d778050-f8d7-43ff-911c-3627ce8864e5_c20,Balón de Baloncesto Spalding VARSIRY FIBA TF-150 Talla 5,Unisex,SPALDING,,29.9,,False,"VARSITY TF-150 puede resistir las canchas y condiciones más duras, desde el camino al parque hasta la cancha ¡es hora de jugar!",,0,naranja,6642622ef8fe2680f3a09c02
80d57697-3398-4dfb-9855-cec5869d5d79_c20,Balón de Baloncesto Spalding VARSIRY FIBA TF-150 Talla 6,Unisex,SPALDING,,29.9,,False,Desde las superficies exteriores más duras hasta las canchas cubiertas.... el Spalding VARSITY TF-150 es el balón perfecto para empezar a escribir tu historia de baloncesto. ¡vamos a por el partido!,,0,naranja,66426237f8fe2680f3a09c03
21119326-4699-450b-b744-7acf0e9c4177_c22,Balonmano Select HB Torneo DB V23 Amarillo,Unisex,SELECT,,37.99,,False,Balón diseñado especialmente para el entrenamiento de jugadores jóvenes. Especialmente resistente gracias a su doble costura.,,0,amarillo / amarillo,6642623ff8fe2680f3a09c04
3069da9d-5157-4f31-835e-e208035d623f_c9,Balonmano Select HB Torneo DB V23 Verde,Unisex,SELECT,,29.0,,False,Balón diseñado especialmente para el entrenamiento de jugadores jóvenes. Especialmente resistente gracias a su doble costura.,,0,verde / verde,66426248f8fe2680f3a09c05
8a249538-c90b-44db-9bdb-a08a42e987d0_c20.c1.c249,Balón de Baloncesto Spalding EUROLEAGUE Varsity TF-150 Talla 5,Unisex,SPALDING,,32.99,,False,"Réplica oficial del balón de la EUROLIGA de baloncesto, ideal para jugadores que se inician al deporte y juegan en todas las canchas.",,0,naranja / negro / plateado,66426251f8fe2680f3a09c06
79c659f6-6f77-4f70-be8d-be5709852ef5_c86.c1.c14,Balón UCL Club Void,Unisex,ADIDAS,,28.0,,False,Juego con el brillo de los mejores,,0,azul cian / negro / rojo,6642625af8fe2680f3a09c07
e8f3e9f7-7f05-4c85-9911-328388a6b1a4_c4.c5,Balón de Rugby Gilbert Seguidor de Italia,Unisex,GILBERT,,28.0,,False,El balón del aficionado luce los colores y el logotipo de Italia.,,0,blanco / azul / azul,66426262f8fe2680f3a09c08
87b1c108-9123-4150-a68b-24df3ff17cdc_c20.c5,Balón baloncesto Wilson NCAA Elevate VTX,Unisex,WILSON,,28.0,,False,Balón de baloncesto Wilson NCAA Elevate con el logotipo del Campeonato Universitario Americano.,,0,naranja / naranja / azul,6642626bf8fe2680f3a09c09
5324c116-7845-42b0-b6c5-1ea6ee909ea6_c255,BALÓN SOPORTE TOULOUSE T5,Unisex,GILBERT,,40.8,50.09,True,"Muestra tu apoyo al Stade Toulousain con el Balón Supporter Toulouse T5, ideal para partidos y entrenamientos.",5.0,1,multicolor,66426274f8fe2680f3a09c0a
488481a9-3031-42bb-a643-c4eb7da7eab6_c4.c14,Balón tercera equipación Manchester United Club,Unisex,ADIDAS,,28.0,,False,Pasión por el United con cada toque,,0,blanco / rojo,6642627cf8fe2680f3a09c0b
c745d5dd-7d02-4344-9353-367a04a2302d_c14,Balón de rugby Gilbert Wales Supporter Pays de Galles,Unisex,GILBERT,,28.0,,False,El balón del aficionado luce los colores y el logotipo de Gales.,,0,rojo,66426285f8fe2680f3a09c0c
c3ad1250-6af4-441b-9837-ff769370f4b1_c4,Balón rugby Gilbert Stade Français,Unisex,GILBERT,,28.0,,False,"La réplica del balón del Stade Français es una réplica exacta del balón utilizado en los partidos oficiales, lo que le convierto en el producto ideal para mostrar tu apoyo a tu equipo favorito.",,0,blanco,6642628ef8fe2680f3a09c0d
c56f9a22-9df7-431a-936e-6279069987c3_c197,Balón de Baloncesto Spalding SILVER SERIES Talla 6,Unisex,SPALDING,,27.95,29.95,True,"Fabricado con caucho duro y resistente, es el balón ideal para las jugadoras que gustan de jugar sus partidos en las duras superficies exteriores.",,0,naranja,66426297f8fe2680f3a09c0e
2aa7e7ab-0dbd-4ff3-987f-2aca836ebd7f_c5.c14.c4,Balón de Baloncesto Spalding Blue Red Graffiti Talla 7,Unisex,SPALDING,,27.95,29.95,True,"Su diseño espectacular junto a unas características técnicas excelentes, lo convierten en un balón perfecto para los jugadores amantes del basket.",,0,azul / rojo / blanco,6642629ff8fe2680f3a09c0f
507a9717-33f8-4f77-8095-59ac974f9366_c197,Balón de Baloncesto Spalding SILVER SERIES Talla 5,Unisex,SPALDING,,24.95,,False,"Fabricado con caucho duro y resistente, es el balón ideal para los jugadores juniors que juegan sin descanso en las duras superficies exteriores.",,0,naranja,664262a8f8fe2680f3a09c10
9e10f0d2-ac6c-49a8-b351-d2c731eda8ef_c1.c4,Balón de Baloncesto Spalding SLAM DUNK Negro T5,Unisex,SPALDING,,29.95,,False,¡Espectacular y rompedor diseño junto a un agarre y resistencia máxima!,,0,negro / blanco,664262b0f8fe2680f3a09c11
7695f3d7-55e2-47bb-be48-40280ee775dc_c197,Balón de Baloncesto Spalding SILVER SERIES Talla 7,Unisex,SPALDING,,27.95,29.95,True,"Fabricado con caucho duro y resistente, es el balón ideal para los jugadores que gustan de jugar sus partidos en las duras superficies exteriores.",,0,naranja,664262baf8fe2680f3a09c12
0e43b3bb-5f96-44b1-8ec6-c1cabacabcd5_c20,Balón baloncesto Molten BR7 T7,Unisex,MOLTEN,,28.0,,False,Balón de goma de alta gama especialmente diseñado para el entrenamiento e ideal para principiantes.,,0,naranja / naranja / naranja,664262c3f8fe2680f3a09c13
27486ede-6e12-4d1b-a036-f96ca6c6359d_c255.c5,Balón de Baloncesto Wilson NBA TEAM TRIBUTE WARRIORS Talla 7,Unisex,WILSON,,29.95,,False,Balón de baloncesto ideal para que los fans de los Boston CELTICS puedan disfrutar del basket en todo tipo de canchas.,,0,multicolor / azul,664262ccf8fe2680f3a09c14
46565749-f44a-46b4-a181-ea1fd1cf03a7_c4,Balón de Fútbol Sala NEO 21308U 759 Blanco,Unisex,UMBRO,,27.8,33.96,True,Balón de Fútbol Sala Umbro NEO 21308U 759 Blanco,,0,blanco,664262d4f8fe2680f3a09c15
8798676,Balón de fútbol americano - NFL DUKE RÉPLICA OFICIAL Marrón,Unisex,WILSON,,26.49,34.99,True,Wilson ha diseñado este balón de fútbol americano para que te entrenes como tus jugadores favoritos.,4.4,8,,664262ddf8fe2680f3a09c16
13828ab5-a346-43d1-ad66-67827bfe8099_c5.c22.c24,Balón de fútbol PUMA Graphic ENERGY PUMA Ultra Blue Yellow Alert Luminous Pink,Unisex,PUMA,,32.99,,False,"El balón PUMA Graphic ENERGY traslada un estilo moderno a la calle, el parque, la pista o el patio. Diseñado con el ADN deportivo de PUMA.",,0,azul / amarillo / rosa,664262e6f8fe2680f3a09c17
5f036f49-6438-4210-9f92-289888b0eed2_c4.c22.c1,Balón entrenamiento Predator,Unisex,ADIDAS,,31.0,,False,Afina tu técnica,,0,blanco / amarillo / negro,664262eff8fe2680f3a09c18
